67.03,"Mahatma Education Society's Pillai HOC College of Engineering & Technology, Tal. Khalapur. Dist. Raigad",Raigad
51.97,"M.D. Yergude Memorial Shikshan Prasarak Mandal's Shri Sai College of Engineering & Technology, Badravati",NA
67.57,"Shri Shivaji Vidya Prasarak Sanstha's Late Bapusaheb Shivaji Rao Deore College of Engineering,Dhule",Dhule
39.01,"Holy-Wood Academy's Sanjeevan Engineering and Technology Institute, Panhala",NA
26.72,"Samarth Education Trust's Arvind Gavali College Of Engineering Panwalewadi, Varye,Satara.",Satara
60.45,"Dr.Rajendra Gode Institute of Technology & Research, Amravati",Amravati
16.4,Shree Siddheshwar Women's College Of Engineering Solapur.,Solapur
89.25,"Indala College Of Engineering, Bapsai Tal.Kalyan",Mumbai
97.93,"Pune Vidyarthi Griha's College of Engineering and Technology, Pune",pune
69.58,"Anjuman-I-Islam's M.H. Saboo Siddik College of Engineering, Byculla, Mumbai",Mumbai
42.64,"Rajgad Dnyanpeeth's Technical Campus,Dhangwadi, Bhor",NA
22.45,"Jaywant College of Engineering & Management, Kille Macchindragad Tal. Walva",NA
68.58,"New Horizon Institute of Technology & Management, Thane",Thane
